{
  "anchor": {
    "anchor_id": "evaluation_spec",
    "anchor_version": "1.0.0",
    "scope": "iteration",
    "owner": "evaluations",
    "status": "draft"
  },
  "eval_id": "mvm_iteration_eval",
  "eval_version": "1.0.0",
  "scope": "promotion",
  "owner": "evaluation",
  "success_criteria": {
    "qualitative": [
      "Deterministic phases remain reproducible.",
      "Interpretive summaries reference measured artifacts."
    ],
    "quantitative": [
      "Overall score meets the minimum threshold.",
      "Clarity and coverage remain above baseline tolerance."
    ]
  },
  "metrics": [
    { "name": "overall_score", "threshold": 0.6, "direction": "min" },
    { "name": "clarity", "threshold": 0.55, "direction": "min" },
    { "name": "coverage", "threshold": 0.55, "direction": "min" }
  ],
  "regression_definition": {
    "tolerance": 0.02,
    "description": "Any metric dropping more than tolerance is a regression."
  },
  "rollback_plan": {
    "artifact": "docs/evaluation/rollback_plan.md",
    "steps": [
      "Revert to the last canonical overlay chain.",
      "Re-run evaluation against the baseline metrics.",
      "Document the regression cause and remediation steps in the evaluation report."
    ]
  }
}
